{
  "schemaVersion": 1,
  "generatedBy": "packages/chip/scripts/check_tee_image_manifest.py (06 WI-3 fixture)",
  "summary": "E1 riscv64 elizaOS-Linux confidential guest image manifest (fixture). Validates against the SHARED OS schema packages/os/release/schema/confidential-image-manifest.schema.json (no copy). substrate=cove, builder=buildroot-elizaos, architecture=riscv64. The image build is BLOCKED on a riscv64 CoVE build host; component digests are golden placeholders pending the reproducible build, so reproducibility.confirmed is false and the checker proves schema-conformance + digest shape + any present-component digest recompute only.",
  "image": {
    "profile": "confidential",
    "substrate": "cove",
    "builder": "buildroot-elizaos",
    "architecture": "riscv64"
  },
  "components": {
    "kernel": {
      "filename": "Image",
      "digest": "sha256:bbbbbbbbbbbbbbbbbbbbbbbbbbbbbbbbbbbbbbbbbbbbbbbbbbbbbbbbbbbbbbbb",
      "measuredInto": "tvm.os (TSM add-region/finalize)"
    },
    "initrd": {
      "filename": "initramfs.cpio.gz",
      "digest": "sha256:1111111111111111111111111111111111111111111111111111111111111111",
      "measuredInto": "tvm.os (TSM add-region/finalize)"
    },
    "rootfs": {
      "filename": "rootfs.squashfs",
      "digest": "sha256:2222222222222222222222222222222222222222222222222222222222222222",
      "measuredInto": "tvm.os (TSM add-region/finalize)"
    },
    "appCompose": {
      "filename": "eliza-agent.compose.json",
      "digest": "sha256:3333333333333333333333333333333333333333333333333333333333333333",
      "measuredInto": "tvm.agent/compose (in-domain attestation agent)"
    }
  },
  "buildInputs": {
    "toolchain": [
      {
        "name": "riscv-none-elf-gcc",
        "version": "15.2.0-1",
        "sha256": "abababababababababababababababababababababababababababababababab"
      },
      {
        "name": "buildroot",
        "version": "2026.02-elizaos",
        "sha256": "cdcdcdcdcdcdcdcdcdcdcdcdcdcdcdcdcdcdcdcdcdcdcdcdcdcdcdcdcdcdcdcd"
      }
    ],
    "layers": [
      {
        "name": "buildroot-elizaos-riscv64",
        "repo": "https://github.com/elizaOS/elizaos-linux",
        "commit": "0123456789abcdef0123456789abcdef01234567"
      }
    ]
  },
  "measurements": {
    "boot": "sha256:aaaaaaaaaaaaaaaaaaaaaaaaaaaaaaaaaaaaaaaaaaaaaaaaaaaaaaaaaaaaaaaa",
    "os": "sha256:bbbbbbbbbbbbbbbbbbbbbbbbbbbbbbbbbbbbbbbbbbbbbbbbbbbbbbbbbbbbbbbb",
    "policy": "sha256:dddddddddddddddddddddddddddddddddddddddddddddddddddddddddddddddd",
    "agent": "sha256:cccccccccccccccccccccccccccccccccccccccccccccccccccccccccccccccc",
    "compose": "sha256:3333333333333333333333333333333333333333333333333333333333333333",
    "device": "sha256:eeeeeeeeeeeeeeeeeeeeeeeeeeeeeeeeeeeeeeeeeeeeeeeeeeeeeeeeeeeeeeee",
    "monitor": "sha256:9999999999999999999999999999999999999999999999999999999999999999",
    "npuFirmware": "sha256:ffffffffffffffffffffffffffffffffffffffffffffffffffffffffffffffff"
  },
  "reproducibility": {
    "confirmed": false,
    "reproBuildContext": null,
    "note": "The reproducible riscv64 CoVE image has not been built (gate tee-image-reproducibility, BLOCKED on a riscv64 CoVE build host). Component digests are golden placeholders, not bytes from a real build."
  },
  "gate": {
    "name": "confidential-image-manifest-check",
    "blockedOn": "riscv64 CoVE build host + meta-confidential/buildroot-elizaos reproducible build",
    "provingCommand": "python3 packages/chip/scripts/check_tee_image_manifest.py"
  }
}
